<?xml version="1.0" encoding="UTF-8"?>
<!--

    Elemental
    Copyright (C) 2024, Evolved Binary Ltd

    admin@evolvedbinary.com
    https://www.evolvedbinary.com | https://www.elemental.xyz

    This library is free software; you can redistribute it and/or
    modify it under the terms of the GNU Lesser General Public
    License as published by the Free Software Foundation; version 2.1.

    This library is distributed in the hope that it will be useful,
    but WITHOUT ANY WARRANTY; without even the implied warranty of
    MERCHANTABILITY or FITNESS FOR A PARTICULAR PURPOSE.  See the GNU
    Lesser General Public License for more details.

    You should have received a copy of the GNU Lesser General Public
    License along with this library; if not, write to the Free Software
    Foundation, Inc., 51 Franklin Street, Fifth Floor, Boston, MA  02110-1301  USA

    NOTE: Parts of this file contain code from 'The eXist-db Authors'.
          The original license header is included below.

    =====================================================================

    eXist-db Open Source Native XML Database
    Copyright (C) 2001 The eXist-db Authors

    info@exist-db.org
    http://www.exist-db.org

    This library is free software; you can redistribute it and/or
    modify it under the terms of the GNU Lesser General Public
    License as published by the Free Software Foundation; either
    version 2.1 of the License, or (at your option) any later version.

    This library is distributed in the hope that it will be useful,
    but WITHOUT ANY WARRANTY; without even the implied warranty of
    MERCHANTABILITY or FITNESS FOR A PARTICULAR PURPOSE.  See the GNU
    Lesser General Public License for more details.

    You should have received a copy of the GNU Lesser General Public
    License along with this library; if not, write to the Free Software
    Foundation, Inc., 51 Franklin Street, Fifth Floor, Boston, MA  02110-1301  USA

-->
<xs:schema xmlns:xs="http://www.w3.org/2001/XMLSchema"
           xmlns:vc="http://www.w3.org/2007/XMLSchema-versioning" vc:minVersion="1.1"
           xmlns:exist="http://exist.sourceforge.net/NS/exist"
           elementFormDefault="qualified"
           targetNamespace="http://exist.sourceforge.net/NS/exist"
           version="1.0.0">
  <xs:element name="configuration">
    <xs:complexType>
      <xs:choice maxOccurs="unbounded">
        <xs:element ref="exist:forward"/>
        <xs:element ref="exist:root"/>
      </xs:choice>
    </xs:complexType>
  </xs:element>
  <xs:element name="forward">
    <xs:complexType>
      <xs:attribute name="pattern" use="required" type="xs:string"/>
      <xs:attribute name="servlet" use="required" type="xs:string"/>
    </xs:complexType>
  </xs:element>
  <xs:element name="root">
    <xs:complexType>
      <xs:attribute name="server-name" use="optional" type="xs:string"/>
      <xs:attribute name="path" use="required" type="xs:anyURI"/>
      <xs:attribute name="pattern" use="required" type="xs:string"/>
    </xs:complexType>
  </xs:element>
</xs:schema>
