<!--
  ++ Base configuration for eXist's URL rewriting. This file defines
  ++ all basic path mappings. A path can be mapped to a servlet or
  ++ the root of a directory or collection hierarchy.
  ++
  ++ The order of elements within this configuration file is significant.
-->
<configuration xmlns="http://exist.sourceforge.net/NS/exist" xmlns:xsi="http://www.w3.org/2001/XMLSchema-instance"
  xsi:schemaLocation="http://exist.sourceforge.net/NS/exist file:../../schema/controller-config.xsd">
  
  <!-- Webstart servlet -->
  <forward pattern="/webstart" servlet="jnlp"/>
  
  <!-- XMLRPC servlet -->
  <forward pattern="/xmlrpc" servlet="org.exist.xmlrpc.RpcServlet"/>
  
  <!-- REST interface -->
  <forward pattern="/(rest|servlet)/" servlet="EXistServlet"/>
  
  <!-- WebDAV interface -->
  <forward pattern="/webdav/" servlet="milton"/>
  
  <!-- RESTXQ -->
  <forward pattern="/restxq/" servlet="RestXqServlet"/>
  
  <!-- Scale images on the fly and cache the output. -->
  <!-- 
  <forward pattern="/images" servlet="ScaleImageJAI"/>
  -->
  
  <!-- The JMX status servlet used to monitor the db -->
  <forward pattern="/status" servlet="JMXServlet"/>
  
  <!-- HTTP requests to /apps are mapped onto the database path /db/apps -->
  <root pattern="/apps" path="xmldb:exist:///db/apps"/>
  
  <!--
    ++ The default fallback web application is served from the
    ++ /etc/webapp directory on the filesystem. 
  -->
  
  <root pattern=".*" path="/"/>
  
  <!-- 
    ++ To redirect requests based on the server name (i.e. www.example.com)
  	++ to a specific collection within the database, comment out the previous
  	++ root line and uncomment the block below with the server-name
  	++ attribute.
    -->
  
  <!-- 
    <root server-name="site1.example.com" pattern="/*" path="xmldb:exist:///db/org/site1/"/>
    <root server-name="site2.example.com" pattern="/*" path="xmldb:exist:///db/org/site2/"/>
    <root server-name="site3.example.com" pattern="/*" path="xmldb:exist:///db/org/site3/"/>
    <root server-name="localhost" pattern=".*" path="/"/>
    <root server-name="site4.example.com" pattern=".*" path="/"/>
    -->
  
  <!-- 
      ++ The following alternative configuration assumes that the main webapp
      ++ is stored in the database. However, the contents of the /etc/webapp directory
      ++ will still be accessible with a /fs prefix in the path.
  -->
  <!--
    <root pattern="/fs" path="/"/>
    <root pattern=".*" path="xmldb:exist:///db/www"/>
  -->
  
  <!--
      ++ Order is important. The following forward rule for XQuery resources has 
      ++ to be last in this document. Otherwise, all XQuery files would be immediately 
      ++ forwarded to the XQueryServlet without ever going through controllers.
  -->
  <forward pattern=".*\.(xq|xql|xqy|xquery)$" servlet="XQueryServlet"/>
  
</configuration>
